[
    {
        "id": 249732561,
        "number": "1",
        "state": "failed",
        "started_at": "2022-04-22T08:33:23Z",
        "finished_at": "2022-04-22T08:36:13Z",
        "href": "/build/249732561",
        "jobs": [
            {
                "id": 567902813,
                "created_at": "2022-04-22T08:32:50.699Z",
                "finished_at": "2022-04-22T08:34:01Z",
                "started_at": "2022-04-22T08:33:24Z",
                "state": "failed",
                "href": "/job/567902813"
            },
            {
                "id": 567902814,
                "created_at": "2022-04-22T08:32:50.703Z",
                "finished_at": "2022-04-22T08:36:13Z",
                "started_at": "2022-04-22T08:33:23Z",
                "state": "failed",
                "href": "/job/567902814"
            }
        ],
        "commit": {
            "sha": "531f35363c44f98a9bc7aec11fd198a5e404a475",
            "message": "Create .travis.yml",
            "compare_url": "https://github.com/huongtn/sample-test/compare/ca9a0613a94a...531f35363c44",
            "committed_at": "2022-04-22T08:32:48Z"
        }
    },
    {
        "id": 249732580,
        "number": "2",
        "state": "failed",
        "started_at": "2022-04-25T10:12:37Z",
        "finished_at": "2022-04-25T10:16:58Z",
        "href": "/build/249732580",
        "jobs": [
            {
                "id": 567902862,
                "created_at": "2022-04-22T08:33:11.925Z",
                "finished_at": "2022-04-25T10:13:14Z",
                "started_at": "2022-04-25T10:12:37Z",
                "state": "failed",
                "href": "/job/567902862"
            },
            {
                "id": 567902863,
                "created_at": "2022-04-22T08:33:11.929Z",
                "finished_at": "2022-04-25T10:16:58Z",
                "started_at": "2022-04-25T10:13:49Z",
                "state": "failed",
                "href": "/job/567902863"
            }
        ],
        "commit": {
            "sha": "531f35363c44f98a9bc7aec11fd198a5e404a475",
            "message": "Create .travis.yml",
            "compare_url": "https://github.com/huongtn/sample-test/compare/ca9a0613a94a50c067793296ef48aaa33ceaa8af...531f35363c44f98a9bc7aec11fd198a5e404a475",
            "committed_at": "2022-04-22T08:32:48Z"
        }
    }
]
